{
  "id": "8cb91b15-9bac-4413-bdcb-c965313ec36e",
  "event_id": "550e8400-e29b-41d4-a716-446655440001",
  "hypothesis": {
    "title": "GitOps reconciliation blocked by missing configuration dependency",
    "description": "Flux controller cannot deploy Helm chart 'app-api-service' because required value 'database.password' is missing from ConfigMap. Recent secret rotation removed this value without updating the chart's dependency declaration.",
    "confidence": 0.85
  },
  "impact": {
    "severity": "critical",
    "affected_components": [
      "flux-controller",
      "app-api-service",
      "flux-kustomization"
    ]
  },
  "recommended_actions": [
    {
      "title": "Restore missing ConfigMap key or update secret reference",
      "description": "Either restore 'database.password' to the app-config-values ConfigMap, or update the Helm chart values.yaml to use a new secret reference (e.g., externalSecrets or Sealed Secrets). Check recent commits from SecOps for secret rotation intent.",
      "urgency": "high"
    },
    {
      "title": "Validate Helm chart compatibility with new secret strategy",
      "description": "Ensure that 'app-api-service@3.2.1' is compatible with the new secret storage mechanism. Run 'helm template' locally to confirm values before committing.",
      "urgency": "high"
    },
    {
      "title": "Coordinate with SecOps on secret rotation SOP",
      "description": "Establish a process where secret rotations are coordinated with application deployment configurations to prevent future mismatches.",
      "urgency": "medium"
    }
  ],
  "evidence_refs": [
    "550e8400-e29b-41d4-a716-446655440001#e0",
    "550e8400-e29b-41d4-a716-446655440001#e1",
    "550e8400-e29b-41d4-a716-446655440001#e2",
    "550e8400-e29b-41d4-a716-446655440001#e3"
  ],
  "created_at": "2026-01-09T14:32:30Z"
}
